question_0,imageurl_0,question_id_0,question_1,imageurl_1,question_id_1,question_2,imageurl_2,question_id_2,question_3,imageurl_3,question_id_3,question_4,imageurl_4,question_id_4,question_5,imageurl_5,question_id_5,question_6,imageurl_6,question_id_6,question_7,imageurl_7,question_id_7
Is the girl young?,http://ugrad.cs.jhu.edu/~jgualla1/images/2413942.jpg,10518300,Is this a young man?,http://ugrad.cs.jhu.edu/~jgualla1/images/2349483.jpg,13469836,Is this a young elephant?,http://ugrad.cs.jhu.edu/~jgualla1/images/2387842.jpg,04149684,Is that a young boy?,http://ugrad.cs.jhu.edu/~jgualla1/images/2377607.jpg,131055746,Does she seem to be young?,http://ugrad.cs.jhu.edu/~jgualla1/images/2364861.jpg,03346600,Does he look young?,http://ugrad.cs.jhu.edu/~jgualla1/images/2374800.jpg,00397999,Is the couple young?,http://ugrad.cs.jhu.edu/~jgualla1/images/2365923.jpg,05429314,Is that a young skateboarder?,http://ugrad.cs.jhu.edu/~jgualla1/images/2356440.jpg,18587350
Is that a young boy?,http://ugrad.cs.jhu.edu/~jgualla1/images/2386438.jpg,0660473,Is the ground young?,http://ugrad.cs.jhu.edu/~jgualla1/images/2393306.jpg,1180853,Is this a young giraffe?,http://ugrad.cs.jhu.edu/~jgualla1/images/2406874.jpg,02513929,Is the boy young?,http://ugrad.cs.jhu.edu/~jgualla1/images/2387842.jpg,04149532,Does she look young?,http://ugrad.cs.jhu.edu/~jgualla1/images/2402121.jpg,19111283,Is this a young zebra?,http://ugrad.cs.jhu.edu/~jgualla1/images/2387034.jpg,14304244,Does the person with the dog look young?,http://ugrad.cs.jhu.edu/~jgualla1/images/713922.jpg,11684998,Does that man look young?,http://ugrad.cs.jhu.edu/~jgualla1/images/2404499.jpg,0270173
Does the girl look young?,http://ugrad.cs.jhu.edu/~jgualla1/images/2371728.jpg,08695166,Is this a young boy?,http://ugrad.cs.jhu.edu/~jgualla1/images/2382935.jpg,0446681,Does she look young?,http://ugrad.cs.jhu.edu/~jgualla1/images/2413942.jpg,10518302,Does the giraffe look young?,http://ugrad.cs.jhu.edu/~jgualla1/images/2406874.jpg,02513914,Is this a young man?,http://ugrad.cs.jhu.edu/~jgualla1/images/2380840.jpg,04965618,Does that boy look young?,http://ugrad.cs.jhu.edu/~jgualla1/images/2338336.jpg,06614347,Does the calf look young?,http://ugrad.cs.jhu.edu/~jgualla1/images/2395326.jpg,0231278,Does the young cow have tiny size?,http://ugrad.cs.jhu.edu/~jgualla1/images/2397982.jpg,13515044
Is the boy young?,http://ugrad.cs.jhu.edu/~jgualla1/images/2408417.jpg,11758975,Does the man look young?,http://ugrad.cs.jhu.edu/~jgualla1/images/2427.jpg,01184648,Does this man seem to be young?,http://ugrad.cs.jhu.edu/~jgualla1/images/2366633.jpg,02574462,Is this a young man?,http://ugrad.cs.jhu.edu/~jgualla1/images/2404499.jpg,0270183,Does the man look young?,http://ugrad.cs.jhu.edu/~jgualla1/images/2393007.jpg,01863752,Is the man young?,http://ugrad.cs.jhu.edu/~jgualla1/images/2322282.jpg,02219847,Is this a young skateboarder?,http://ugrad.cs.jhu.edu/~jgualla1/images/2367328.jpg,02871436,Is the girl young?,http://ugrad.cs.jhu.edu/~jgualla1/images/713373.jpg,01490703
Is the boy young?,http://ugrad.cs.jhu.edu/~jgualla1/images/286099.jpg,179457,Is the girl young?,http://ugrad.cs.jhu.edu/~jgualla1/images/2373168.jpg,05749517,Is this a young elephant?,http://ugrad.cs.jhu.edu/~jgualla1/images/2414858.jpg,00295801,Does she look young?,http://ugrad.cs.jhu.edu/~jgualla1/images/2371325.jpg,02245758,Does this boy seem to be young?,http://ugrad.cs.jhu.edu/~jgualla1/images/2383350.jpg,09892621,Does the young person look tall?,http://ugrad.cs.jhu.edu/~jgualla1/images/2408048.jpg,18454044,Does the man look young?,http://ugrad.cs.jhu.edu/~jgualla1/images/150449.jpg,13654626,Is this a young woman?,http://ugrad.cs.jhu.edu/~jgualla1/images/2337156.jpg,1519092
Is this woman young?,http://ugrad.cs.jhu.edu/~jgualla1/images/2402121.jpg,19111282,Is the man young?,http://ugrad.cs.jhu.edu/~jgualla1/images/150449.jpg,13654625,Does the girl look young?,http://ugrad.cs.jhu.edu/~jgualla1/images/1592715.jpg,06549398,Is this a young boy?,http://ugrad.cs.jhu.edu/~jgualla1/images/2393683.jpg,16806701,Does this child look young?,http://ugrad.cs.jhu.edu/~jgualla1/images/2345483.jpg,18458781,Is that a young girl?,http://ugrad.cs.jhu.edu/~jgualla1/images/2410375.jpg,12431999,Does this woman look young?,http://ugrad.cs.jhu.edu/~jgualla1/images/2403045.jpg,05276857,Is the skier young?,http://ugrad.cs.jhu.edu/~jgualla1/images/2415046.jpg,0726631
Does the young bear look baby?,http://ugrad.cs.jhu.edu/~jgualla1/images/2393405.jpg,11318634,Does this child look young?,http://ugrad.cs.jhu.edu/~jgualla1/images/2345483.jpg,18458781,Does the polar bear look young?,http://ugrad.cs.jhu.edu/~jgualla1/images/2317229.jpg,18275299,Is the woman young?,http://ugrad.cs.jhu.edu/~jgualla1/images/2399053.jpg,131059148,Is this a young man?,http://ugrad.cs.jhu.edu/~jgualla1/images/2380840.jpg,04965618,Does the boy look young?,http://ugrad.cs.jhu.edu/~jgualla1/images/2408417.jpg,11758976,Does the skateboarder look young?,http://ugrad.cs.jhu.edu/~jgualla1/images/2367328.jpg,02871418,Does she look young?,http://ugrad.cs.jhu.edu/~jgualla1/images/2391748.jpg,0074797
